Title,Usage,Price
Aquacolor Candypack Spicy Gray Zero P...,Usage: 8H . 2 Lens per Box,₹169
Aquacolor Candypack Tricky Turquoise ...,Usage: 8H . 2 Lens per Box,₹169
Aquacolor Candypack Walnut Brown Zero...,Usage: 8H . 2 Lens per Box,₹169
Aquacolor Candypack Stormy Gray Zero ...,Usage: 8H . 2 Lens per Box,₹169
Aquacolor Candypack Mystery Brown Dai...,Usage: 8H . 2 Lens Pack,₹169
Aquacolor Candypack Misty Gray Zero P...,Usage: 8H . 2 Lens per Box,₹169
Aquacolor Candypack Submarine Blue Ze...,Usage: 8H . 2 Lens per Box,₹169
Aquacolor Premium Gray Powered Monthl...,Usage: 8H . 1 Lens per Box,₹299
Aquacolor Premium Brown Powered Month...,Usage: 8H . 1 Lens per Box,₹299
Aquacolor Candypack Envy Green Zero P...,Usage: 8H . 2 Lens per Box,₹169
Aquacolor Premium Mystery Hazel Month...,Usage: 8H . 1 Lens per Box,₹299
Aquacolor Premium Naughty Brown Power...,Usage: 8H . 1 Lens per Box,₹299
Aquacolor Premium Dusk Blue Zero Powe...,Usage: 8H . 2 Lens per Box,₹299
Aquacolor Premium Dusky Brown Zero Po...,Usage: 8H . 2 Lens per Box,₹299
Aquacolor Premium Dusky Brown Powered...,Usage: 8H . 1 Lens per Box,₹299
Aquacolor Premium Tricky Turquoise Ze...,Usage: 8H . 2 Lens per Box,₹299
Aquacolor Premium Flirty Blue Zero Po...,Usage: 8H . 2 Lens per Box,₹299
Aquacolor Premium Emerald Zero Power ...,Usage: 8H . 2 Lens per Box,₹299
Aquacolor Spicy Gray Premium Powered ...,Usage: 8H . 1 Lens per Box,₹299
Aquacolor Candypack Dusky Brown Power...,Usage: 8H . 2 Lens per Box,₹199
Aquacolor Premium Silver Gray Powered...,Usage: 8H . 1 Lens per Box,₹299
Aquacolor Premium Gray Zero Power Mon...,Usage: 8H . 2 Lens per Box,₹299
Aquacolor Premium Dusk Blue Powered M...,Usage: 8H . 1 Lens per Box,₹299
Aquacolor Premium Brown Zero Power Mo...,Usage: 8H . 2 Lens per Box,₹299
Aquacolor Premium Silver Gray Zero Po...,Usage: 8H . 2 Lens per Box,₹299
Aquacolor Premium Emerald Powered Mon...,Usage: 8H . 1 Lens per Box,₹299
Aquacolor Premium Tricky Turquoise Po...,Usage: 8H . 1 Lens per Box,₹299
Aquacolor Premium Icy Blue Powered Mo...,Usage: 8H . 1 Lens per Box,₹299
Aquacolor Premium Envy Green Powered ...,Usage: 8H . 1 Lens per Box,₹299
Aquacolor Envy Green Zero Power Daily,Usage: 8H . 10 Lens per Box,₹499
Aquacolor Premium Flirty Blue Powered...,Usage: 8H . 1 Lens per Box,₹299
Aquacolor Premium Spicy Gray Zero Pow...,Usage: 8H . 2 Lens per Box,₹299
Aquacolor Spicy Gray Zero Power Daily,Usage: 8H . 10 Lens per Box,₹599
Aquacolor Peacock Green Zero Power Da...,Usage: 8H . 10 Lens per Box,₹599
Aquacolor Premium Mystery Hazel Zero ...,Usage: 8H . 2 Lens per Box,₹299
Aquacolor Stormy Gray Zero Power Dail...,Usage: 8H . 10 Lens per Box,₹599
Aquacolor Premium Naughty Brown Zero ...,Usage: 8H . 2 Lens per Box,₹299
Aquacolor Misty Gray Zero Power Daily,Usage: 8H . 10 Lens per Box,₹599
Aquacolor Mystery Hazel Zero Power Mo...,Usage: 8H . 2 Lens per Box,₹299
Aquacolor Premium Envy Green Zero Pow...,Usage: 8H . 2 Lens per Box,₹299
Alcon Freshlook Allure Hazel Powered ...,Usage: 8H . 10 Lens per Box,₹1575
Bausch & Lomb Soflens Multifocal Lens...,Usage: 10H . 6 Lens per Box,₹2799
Aqualens Daily Disposable Multifocal ...,Usage: 24H . 30 Lens per Box,₹2000
Aquacolor Dusky Brown Zero Power Dail...,Usage: 8H . 10 Lens per Box,₹599
Aquacolor Candypack Mystery Brown Pow...,Usage: 24H . 2 Lens per Box,₹199
Aquacolor Midnight Black Zero Power D...,Usage: 8H . 10 Lens per Box,₹499
Aquacolor Black Rose Zero Power Daily,Usage: 8H . 10 Lens per Box,₹599
Acuvue Moist 1 Day Multifocal Daily D...,Usage: 10H . 30 Lens per Box,₹2495
Aquacolor Honey Brown Zero Power Mont...,Usage: 8H . 2 Lens per Box,₹299
Aquacolor Submarine Blue Zero Power D...,Usage: 8H . 10 Lens per Box,₹599
Aquacolor Dusky Brown Zero Power Mont...,Usage: 8H . 2 Lens per Box,₹299
Aquacolor Mystery Brown Zero Power Da...,Usage: . 10 Lens Pack,₹599
Alcon Freshlook Allure Gray Powered D...,Usage: 8H . 10 Lens per Box,₹1575
Aquacolor Tricky Turquoise Zero Power...,Usage: 8H . 10 Lens per Box,₹599
Bausch & Lomb Lacelle Brown Zero Powe...,Usage: 8H . 1 Lens per Box,₹499
Aquacolor Coco Brown Zero Power Daily,Usage: 8H . 10 Lens per Box,₹599
Aquacolor Venus Gray Zero Power Month...,Usage: 8H . 2 Lens per Box,₹299
Aquacolor Olive Green Zero Power Mont...,Usage: 8H . 2 Lens per Box,₹299
Aquacolor Tricky Turquoise Zero Power...,Usage: 8H . 2 Lens per Box,₹299
Aquacolor Sapphire Blue Zero Power Mo...,Usage: 8H . 2 Lens per Box,₹299
Alcon Freshlook Allure Blue Powered D...,Usage: 8H . 10 Lens per Box,₹1575
Aquacolor Emerald Blue Zero Power Mon...,Usage: 8H . 2 Lens per Box,₹299
Aquacolor Green Zero Power Six Monthl...,Usage: 8H . 2 Lens per Box,₹749
Aquacolor Cosmo Violet Zero Power Mon...,Usage: 8H . 2 Lens per Box,₹299
Aquacolor Walnut Brown Zero Power Dai...,Usage: 8H . 10 Lens per Box,₹599
Aquacolor Sunkissed Gray Zero Power M...,Usage: 8H . 2 Lens per Box,₹399
Aquacolor Snowflake Gray Zero Power M...,Usage: 8H . 2 Lens per Box,₹399
Aquacolor Mocha Brown Zero Power Dail...,Usage: 8H . 10 Lens per Box,₹599
Aquacolor Pine Green Zero Power Month...,Usage: 8H . 2 Lens per Box,₹299
Aquacolor Celestial Gray Zero Power M...,Usage: 8H . 2 Lens per Box,₹399
J&J Bubble Pop Pastel Purple Zero Pow...,Usage: 8H . 2 Lens per Box,₹199
Bausch & Lomb Lacelle Gray Zero Power...,Usage: 8H . 2 Lens per Box,₹629
Aquacolor Aqua Green Zero Power Daily,Usage: 8H . 10 Lens per Box,₹599
Aquacolor Frosty Blue Zero Power Mont...,Usage: 8H . 2 Lens per Box,₹399
Aquacolor Premium Icy Blue Monthly,Usage: 8H . 2 Lens per Box,₹299
Aquacolor Bahama Blue Zero Power Mont...,Usage: 8H . 2 Lens per Box,₹399
Alcon Air Optix Sterling Gray Zero Po...,Usage: 8H . 2 Lens per Box,₹1200
Bausch & Lomb Lacelle Hazel Zero Powe...,Usage: 8H . 1 Lens per Box,₹699
Aquacolor Fierce Green Zero Power Dai...,Usage: 8H . 10 Lens per Box,₹499
Aquacolor Coral Brown Zero Power Mont...,Usage: 8H . 2 Lens per Box,₹399
Bausch & Lomb Lacelle Gray Zero Power...,Usage: 8H . 1 Lens per Box,₹499
Aquacolor Sky Blue Zero Power Daily,Usage: 8H . 10 Lens per Box,₹599
Aquacolor Halo Black Zero Power Month...,Usage: 8H . 2 Lens per Box,₹299
Aquacolor Galaxy Green Zero Power Mon...,Usage: 8H . 2 Lens per Box,₹399
Aquacolor Peachy Brown Zero Power Mon...,Usage: 8H . 2 Lens per Box,₹399
Bausch & Lomb Lacelle Brown Zero Powe...,Usage: 8H . 2 Lens per Box,₹629
Bausch & Lomb Lacelle Hazel Zero Powe...,Usage: 8H . 2 Lens per Box,₹629
Alcon Air Optix Pure Hazel Zero Power...,Usage: 8H . 2 Lens per Box,₹1200
Clalen Iris Suzy Gray Zero Power Dail...,Usage: 8H . 10 Lens per Box,₹249
Clalen Iris Alicia Brown Zero Power D...,Usage: 8H . 10 Lens per Box,₹399
Clalen Iris Soul Brown Zero Power Dai...,Usage: 8H . 10 Lens per Box,₹249
Bausch & Lomb Lacelle Hazel Zero Powe...,Usage: 8H . 2 Lens per Box,₹899
Alcon Air Optix Gray Zero Power Month...,Usage: 8H . 2 Lens per Box,₹1200
Aquacolor Reivera Green Zero Power Mo...,Usage: 8H . 2 Lens per Box,₹399
Bausch & Lomb Lacelle Dark Hazel Zero...,Usage: 8H . 1 Lens per Box,₹699
Clalen Iris Estelle Gray Zero Power D...,Usage: 8H . 10 Lens per Box,₹399
Clalen Iris Blue Moon Zero Power Dail...,Usage: 8H . 10 Lens per Box,₹399
Clalen Iris Grace Gray Zero Power Mon...,Usage: 8H . 2 Lens per Box,₹249
Alcon Air Optix Brilliant Blue Zero P...,Usage: 8H . 2 Lens per Box,₹1249
Clalen Iris Lucy Gray Zero Power Mont...,Usage: 8H . 2 Lens per Box,₹249
Clalen Iris Claire Brown Zero Power M...,Usage: 8H . 2 Lens per Box,₹399
Alcon Air Optix Gemstone Green Zero P...,Usage: 8H . 2 Lens per Box,₹1200
Aquacolor Tangy Brown Zero Power Mont...,Usage: 8H . 2 Lens per Box,₹399
Clalen Iris Estelle Brown Zero Power ...,Usage: 8H . 10 Lens per Box,₹399
Clalen Iris Astra Glitter Zero Power ...,Usage: 8H . 10 Lens per Box,₹399
Clalen Iris Sunflower Gray Zero Power...,Usage: 8H . 2 Lens per Box,₹249
Clalen Iris Latin Zero Power Daily,Usage: 8H . 10 Lens per Box,₹249
Clalen Iris Joy Green Zero Power Mont...,Usage: 8H . 2 Lens per Box,₹249
Bausch & Lomb Lacelle Dark Green Zero...,Usage: 8H . 1 Lens per Box,₹699
Bausch & Lomb Lacelle Gray Zero Power...,Usage: 8H . 2 Lens per Box,₹899
Bausch & Lomb Lacelle Blue Zero Power...,Usage: 8H . 2 Lens per Box,₹629
Bausch & Lomb Lacelle Violet Zero Pow...,Usage: 8H . 2 Lens per Box,₹629
Bausch & Lomb Lacelle Hazel Zero Powe...,Usage: 8H . 1 Lens per Box,₹499
Clalen Iris Suzy Brown Zero Power Dai...,Usage: 8H . 10 Lens per Box,₹249
Clalen Iris Sunflower Brown Zero Powe...,Usage: 8H . 2 Lens per Box,₹249
Clalen Iris Lily Green Zero Power Mon...,Usage: 8H . 2 Lens per Box,₹249
Alcon Air Optix Honey Zero Power Mont...,Usage: 8H . 2 Lens per Box,₹1200
Bausch & Lomb Lacelle Topaz Blue Zero...,Usage: 8H . 2 Lens per Box,₹899
Bausch & Lomb Lacelle Violet Amethyst...,Usage: 8H . 2 Lens per Box,₹899
Clalen Iris Rhapsody Zero Power Daily,Usage: 8H . 10 Lens per Box,₹249
Clalen Iris Jazz Black Zero Power Dai...,Usage: 8H . 10 Lens per Box,₹249
Clalen Iris Selena Purple Zero Power ...,Usage: 8H . 2 Lens per Box,₹249
Clalen Iris Claire Gray Zero Power Mo...,Usage: 8H . 2 Lens per Box,₹399
Alcon Air Optix Brown Zero Power Mont...,Usage: 8H . 2 Lens per Box,₹1200
Alcon Air Optix Blue Zero Power Month...,Usage: 8H . 2 Lens per Box,₹1200
Bausch & Lomb Lacelle Topaz Blue Zero...,Usage: 8H . 1 Lens per Box,₹699
Bausch & Lomb Lacelle Blue Zero Power...,Usage: 8H . 1 Lens per Box,₹699
Bausch & Lomb Lacelle Turquoise Green...,Usage: 8H . 1 Lens per Box,₹699
Bausch & Lomb Lacelle Violet Amethyst...,Usage: 8H . 1 Lens per Box,₹699
Bausch & Lomb Lacelle Turquoise Green...,Usage: 8H . 2 Lens per Box,₹899
Bausch & Lomb Lacelle Ocean Green Zer...,Usage: 8H . 2 Lens per Box,₹899
Bausch & Lomb Lacelle Aqua Zero Power...,Usage: 8H . 2 Lens per Box,₹899
Bausch & Lomb Lacelle Blue Zero Power...,Usage: 8H . 1 Lens per Box,₹499
Clalen Iris Chloe Brown Zero Power Mo...,Usage: 8H . 2 Lens per Box,₹399
Clalen Iris Emma Gray Zero Power Mont...,Usage: 8H . 2 Lens per Box,₹399
Clalen Iris Joy Purple Zero Power Mon...,Usage: 8H . 2 Lens per Box,₹249
Clalen Iris Rachel Gray Zero Power Mo...,Usage: 8H . 2 Lens per Box,₹249
Bausch & Lomb Lacelle Dark Hazel Zero...,Usage: 8H . 2 Lens per Box,₹899
Bausch & Lomb Lacelle Light Green Zer...,Usage: 8H . 2 Lens per Box,₹899
Bausch & Lomb Lacelle Violet Zero Pow...,Usage: 8H . 1 Lens per Box,₹499
